<?xml version="1.0" encoding="UTF-8" standalone="no"?>
<TA xmlns:xsi="http://www.w3.org/2001/XMLSchema-instance" xsi:noNamespaceSchemaLocation="TA.xsd">
    
    <types>
        <primitive byteOrder="byte" id="BNR" name="BYTE" size="8" type="0"/>
        <primitive byteOrder="int" id="BNR" name="UINT_8" size="8" type="0"/>
        <primitive byteOrder="String" id="STR" name="STRING_10CHAR" size="0" type="10"/>
        <primitive byteOrder="String" id="STR" name="STRING_VARSIZE" size="0" type="1"/>
        <primitive byteOrder="char" id="CB2" name="CHAR" size="8" type="0"/>
        
        <structure name=""/>
        
        <arrayType constantElementCount="" elementType="BYTE" name="CheckSumArray"/>
        <arrayType constantElementCount="" elementType="BYTE_CB2" name="CharArray"/>
        <arrayType constantElementCount="" elementType="UINT_8" name="UINT_8_Array"/>
        <arrayType constantElementCount="" elementType="UINT_8" name="UINT_8_Array_Len3"/>
        <arrayType constantElementCount="" elementType="STRUCT1" name="STRUCT1_Array_VarSize"/>
        <arrayType constantElementCount="" elementType="STRUCT1" name="STRUCT1_Array_ConstSize3"/>
        <arrayType constantElementCount="" elementType="CHAR" name="CharTypeArray"/>
        <arrayType constantElementCount="" elementType="BYTE" name="PreambleNoConstSizeArray"/>
    </types>
    
    <messages>
        <message id="2" name="Message2">
            <field fieldIndex="0" name="field0" type="UINT_8"/>
            <field fieldIndex="1" name="field1" type="UINT_8"/>
            <field fieldIndex="2" name="field2" type="UINT_8"/>
        </message>
        
        <message id="3" name="Message3">
            <field fieldIndex="0" name="field0" type="UINT_8"/>
            <field fieldIndex="1" name="field1" type="UINT_8"/>
            <field fieldIndex="2" name="field2" type="UINT_8"/>
        </message>
        
        <message id="4" name="Message4">
            <field fieldIndex="0" name="field0" type="UINT_8"/>
            <field fieldIndex="1" name="field1" type="UINT_8"/>
            <field fieldIndex="2" name="field2" type="UINT_8"/>
            <field fieldIndex="3" name="field3" type="UINT_8"/>
        </message>
        
        <message id="5" name="Message5">
            <field fieldIndex="0" name="field0" type="STRING_10CHAR"/>
            <field fieldIndex="1" name="field1" type="STRING_10CHAR"/>
            <field fieldIndex="2" name="field2" type="STRING_10CHAR"/>
            <field fieldIndex="3" name="field3" type="STRING_10CHAR"/>
        </message>
        
        <message id="6" name="Message6">
            <field fieldIndex="0" name="field0" type="UINT_8"/>
            <field elementCountMessageField="field0" fieldIndex="1" name="field1" type="CharArray"/>
        </message>
        
        <message id="7" name="Message7">
            <field fieldIndex="0" name="field0" type="UINT_8"/>
            <field elementCountMessageField="field0" fieldIndex="1" name="field1" type="STRUCT1_Array_VarSize"/>
        </message>
        
        <message id="8" name="Message8">
            <field fieldIndex="0" name="field0" type="UINT_8"/>
            <field fieldIndex="1" name="field1" type="STRUCT1_Array_ConstSize3"/>
        </message>
        
        <message id="9" name="Message9">
            <field fieldIndex="0" name="field0" type="UINT_8_Array"/>
        </message>
        
        <message id="10" name="Message10">
            <field fieldIndex="0" name="field0" type="UINT_8"/>
        </message>
        
        <message id="10" name="Message10"/>
        
    </messages>
    
    <codecs>
        
        <codec byteOrder="BIG_ENDIAN" name="EasyCodec_PrePost_BigEnd">
            <header>
                <field fieldIndex="0" fieldProperty="Preamble" name="msgPreamble" type="PrePostAmbleArray"/>
                <field fieldIndex="1" fieldProperty="Id" name="msgId" type="UINT_8"/>
            </header>
            <footer>
                <field fieldIndex="0" fieldProperty="Postamble" name="msgPostamble" type="PrePostAmbleArray"/>
            </footer>
            
            <message name="Message1"/>
            <message name="Message2"/>
            <message name="Message3"/>
            <message name="Message4"/>
            <message name="Message5"/>
            <message name="Message6"/>
            <message name="Message7"/>
            <message name="Message8"/>
            <message name="Message9"/>
            
        </codec>
        
        <codec byteOrder="BIG_ENDIAN" name="EasyCodec_IdLen_BigEnd_Checksum">
            <header>
                <field fieldIndex="0" fieldProperty="Id" name="msgId" type="UINT_8"/>
                <field fieldIndex="1" fieldProperty="TotalSize" name="msglength" type="UINT_8"/>
            </header>
            <footer>
                <field fieldIndex="0" fieldProperty="Checksum" name="msgChecksum" type="CheckSumArray"/>
            </footer>
            
            <message name="Message1"/>
            <message name="Message2"/>
            <message name="Message3"/>
            <message name="Message4"/>
            <message name="Message5"/>
            <message name="Message6"/>
            <message name="Message7"/>
            <message name="Message8"/>
            <message name="Message9"/>
            
        </codec>
        
        <codec byteOrder="BIG_ENDIAN" name="EasyCodec_Id_BigEnd_Checksum">
            <header>
                <field fieldIndex="0" fieldProperty="Id" name="msgId" type="UINT_8"/>
                <field fieldIndex="1" name="msgHeaderField0" type="UINT_8"/>
            </header>
            <footer>
                <field fieldIndex="0" fieldProperty="Checksum" name="msgChecksum" type="CheckSumArray"/>
            </footer>
            
            <message name="Message1"/>
            <message name="Message2"/>
            <message name="Message3"/>
            <message name="Message4"/>
            <message name="Message5"/>
            <message name="Message6"/>
            <message name="Message7"/>
            <message name="Message8"/>
            <message name="Message9"/>
            
        </codec>
        
        <codec byteOrder="BIG_ENDIAN" name="EasyCodec_IdLen_BigEnd_CalculatedSize">
            <header>
                <field fieldIndex="0" name="field0" type="UINT_8"/>
                <field fieldIndex="1" fieldProperty="CalculatedSize" name="length" type="UINT_8"/>
                <field fieldIndex="2" name="field2" type="UINT_8"/>
                <field fieldIndex="3" fieldProperty="Id" name="msgId" type="UINT_8"/>
            </header>
            <footer/>
            
            <message name="Message1"/>
            
        </codec>
        
        <codec byteOrder="BIG_ENDIAN" name="EasyCodec_IdLenPayload_BigEnd">
            <header>
                <field fieldIndex="0" fieldProperty="Id" name="msgId" type="UINT_8"/>
                <field fieldIndex="1" fieldProperty="PayloadSize" name="msglength" type="UINT_8"/>
            </header>
            <footer/>
            
            <message name="Message1"/>
            <message name="Message11"/>
            
        </codec>
        
        <codec byteOrder="BIG_ENDIAN" name="EasyCodec_IdLen_BigEnd_HeaderArray">
            <header>
                <field fieldIndex="0" fieldProperty="Id" name="msgId" type="UINT_8"/>
                <field fieldIndex="1" fieldProperty="TotalSize" name="msglength" type="UINT_8"/>
                <field fieldIndex="2" name="fieldHeaderArr" type="UINT_8_Array_Len3"/>
            </header>
            <footer/>
            
            <message name="Message1"/>
            
        </codec>
    </codecs>
    
</TA>
